season,id,name,short_name,description,home_team,away_team,toss_won,decision,1st_inning_score,2nd_inning_score,home_score,away_score,winner,result,start_date,end_date,venue_id,venue_name,home_captain,away_captain,pom,points,super_over,home_overs,home_runs,home_wickets,home_boundaries,away_overs,away_runs,away_wickets,away_boundaries,highlights,home_key_batsman,home_key_bowler,home_playx1,away_playx1,away_key_batsman,away_key_bowler,match_days,umpire1,umpire2,tv_umpire,referee,reserve_umpire
2024,1422138,Mumbai Indians v Delhi Capitals,MI v DC,"20th Match (D/N), Indian Premier League at Mumbai, Apr 7 2024",MI,DC,DC,BOWL FIRST,234/5,205/8,234/5,205/8,MI,MI won by 29 runs,2024-04-07T10:00Z,2024-04-08T23:59Z,58324,"Wankhede Stadium, Mumbai",Hardik Pandya,Rishabh Pant,Romario Shepherd,"Mumbai Indians 2, Delhi Capitals 0",False,20,234,5,33,20,205,8,29,"Shepherd, David and Bumrah help Mumbai get off the mark. Stubbs' blazing fifty not enough as Coetzee picks up four wickets to consign Capitals to a fourth loss in five games","Rohit Sharma,Tim David","Gerald Coetzee,Jasprit Bumrah","Rohit Sharma (UKN),Ishan Kishan (WK),Suryakumar Yadav (UKN),Hardik Pandya (AR),Tilak Varma (AR),Tim David (UKN),Romario Shepherd (AR),Mohammad Nabi (AR),Gerald Coetzee (BL),Piyush Chawla (AR),Jasprit Bumrah (BL),Akash Madhwal (BL)","Prithvi Shaw (UKN),David Warner (UKN),Abishek Porel (UKN),Tristan Stubbs (UKN),Rishabh Pant (WK),Axar Patel (AR),Lalit Yadav (AR),Kumar Kushagra (UKN),Jhye Richardson (BL),Anrich Nortje (BL),Ishant Sharma (BL),Khaleel Ahmed (BL)","Tristan Stubbs,Prithvi Shaw","Axar Patel,Anrich Nortje",7 April 2024 - day/night match (20-over match),Kumar Dharmasena,Ulhas Gandhe,KN Ananthapadmanabhan,Prakash Bhatt,Vaibhav Dhokre
2024,1422139,Lucknow Super Giants v Gujarat Titans,LSG v GT,"21st Match (N), Indian Premier League at Lucknow, Apr 7 2024",LSG,GT,LSG,BAT FIRST,163/5,130,163/5,130,LSG,LSG won by 33 runs,2024-04-07T14:00Z,2024-04-08T23:59Z,1070094,"Bharat Ratna Shri Atal Bihari Vajpayee Ekana Cricket Stadium, Lucknow",KL Rahul,Shubman Gill,Yash Thakur,"Lucknow Super Giants 2, Gujarat Titans 0",False,20,163,5,17,18.5,130,10,13,"Spinners, Yash Thakur defend 163 to seal LSG's first-ever win against Titans. Titans looked on track in the chase at a point but then lost eight wickets for just 48 runs","Marcus Stoinis,KL Rahul","Yash Thakur,Krunal Pandya","Quinton de Kock (UKN),KL Rahul (WK),Devdutt Padikkal (UKN),Marcus Stoinis (AR),Nicholas Pooran (UKN),Ayush Badoni (UKN),Krunal Pandya (AR),Ravi Bishnoi (BL),Naveen-ul-Haq (BL),Yash Thakur (BL),Mayank Yadav (BL),Manimaran Siddharth (BL)","Sai Sudharsan (UKN),Shubman Gill (UKN),Kane Williamson (UKN),BR Sharath (WK),Vijay Shankar (AR),Darshan Nalkande (BL),Rahul Tewatia (AR),Rashid Khan (AR),Umesh Yadav (BL),Spencer Johnson (BL),Noor Ahmad (BL),Mohit Sharma (BL)","Sai Sudharsan,Rahul Tewatia","Umesh Yadav,Darshan Nalkande",7 April 2024 - night match (20-over match),Nand Kishore,Virender Sharma,Nitin Menon,Javagal Srinath,Madanagopal Kuppuraj
2024,1426260,Chennai Super Kings v Kolkata Knight Riders,CSK v KKR,"22nd Match (N), Indian Premier League at Chennai, Apr 8 2024",CSK,KKR,CSK,BOWL FIRST,137/9,141/3,141/3,137/9,CSK,CSK won by 7 wkts (14b rem),2024-04-08T14:00Z,2024-04-09T23:59Z,58008,"MA Chidambaram Stadium, Chepauk, Chennai",Ruturaj Gaikwad,Shreyas Iyer,Ravindra Jadeja,"Chennai Super Kings 2, Kolkata Knight Riders 0",False,17.4,141,3,18,20,137,9,15,"Jadeja & Co pin KKR before Gaikwad finishes the job. On a track typical of the ones we've seen at Chepauk in seasons past, Super Kings handed Knight Riders their first loss of IPL 2024","Ruturaj Gaikwad,Shivam Dube","Ravindra Jadeja,Tushar Deshpande","Rachin Ravindra (AR),Ruturaj Gaikwad (UKN),Daryl Mitchell (AR),Shivam Dube (AR),MS Dhoni (WK),Ajinkya Rahane (UKN),Sameer Rizvi (UKN),Ravindra Jadeja (AR),Shardul Thakur (BL),Tushar Deshpande (BL),Maheesh Theekshana (BL),Mustafizur Rahman (BL)","Phil Salt (WK),Sunil Narine (AR),Angkrish Raghuvanshi (UKN),Shreyas Iyer (UKN),Venkatesh Iyer (AR),Ramandeep Singh (UKN),Rinku Singh (UKN),Andre Russell (AR),Anukul Roy (AR),Mitchell Starc (BL),Vaibhav Arora (BL),Varun Chakravarthy (BL)","Shreyas Iyer,Sunil Narine","Vaibhav Arora,Sunil Narine",8 April 2024 - night match (20-over match),Anil Chaudhary,Saidharshan Kumar,Bruce Oxenford,Manu Nayar,Mohit Krishnadas
2024,1426261,Punjab Kings v Sunrisers Hyderabad,PBKS v SRH,"23rd Match (N), Indian Premier League at Mohali, Apr 9 2024",PBKS,SRH,KXIP,BOWL FIRST,182/9,180/6,180/6,182/9,SRH,SRH won by 2 runs,2024-04-09T14:00Z,2024-04-10T23:59Z,1290799,"Maharaja Yadavindra Singh International Cricket Stadium, Mullanpur",Shikhar Dhawan,Pat Cummins,Nitish Kumar Reddy,"Sunrisers Hyderabad 2, Punjab Kings 0",False,20,180,6,25,20,182,9,26,SRH survive another Shashank-Ashutosh blitz in two-run win. All-round Nitish Kumar Reddy backed up by the SRH quicks took the side over the line defending 182,"Shashank Singh,Ashutosh Sharma","Arshdeep Singh,Harshal Patel","Shikhar Dhawan (UKN),Jonny Bairstow (UKN),Prabhsimran Singh (UKN),Sam Curran (AR),Sikandar Raza (AR),Shashank Singh (AR),Jitesh Sharma (WK),Ashutosh Sharma (AR),Harpreet Brar (BL),Harshal Patel (BL),Kagiso Rabada (BL),Arshdeep Singh (BL)","Travis Head (UKN),Abhishek Sharma (AR),Aiden Markram (UKN),Nitish Kumar Reddy (AR),Rahul Tripathi (UKN),Heinrich Klaasen (WK),Abdul Samad (UKN),Shahbaz Ahmed (AR),Pat Cummins (BL),Bhuvneshwar Kumar (BL),Jaydev Unadkat (BL),T Natarajan (BL)","Nitish Kumar Reddy,Abdul Samad","Bhuvneshwar Kumar,Pat Cummins",9 April 2024 - night match (20-over match),Navdeep Singh,Nikhil Patwardhan,Alex Wharf,Narayanan Kutty,Pranav Joshi
2024,1426262,Rajasthan Royals v Gujarat Titans,RR v GT,"24th Match (N), Indian Premier League at Jaipur, Apr 10 2024",RR,GT,GT,BOWL FIRST,196/3,199/7,196/3,199/7,GT,GT won by 3 wkts (0b rem),2024-04-10T14:00Z,2024-04-11T23:59Z,58162,"Sawai Mansingh Stadium, Jaipur",Sanju Samson,Shubman Gill,Rashid Khan,"Gujarat Titans 2, Rajasthan Royals 0",False,20,196,3,24,20,199,7,24,"Titans script a thrilling twist to end Royals' winning run. Shubman Gill set up the chase but it looked like Royals had wrested control, until Rahul Tewatia and Rashid Khan came together","Riyan Parag,Sanju Samson","Kuldeep Sen,Yuzvendra Chahal","Yashasvi Jaiswal (UKN),Jos Buttler (UKN),Sanju Samson (WK),Riyan Parag (UKN),Shimron Hetmyer (UKN),Dhruv Jurel (UKN),Ravichandran Ashwin (AR),Trent Boult (BL),Avesh Khan (BL),Kuldeep Sen (BL),Yuzvendra Chahal (BL),Keshav Maharaj (BL)","Sai Sudharsan (UKN),Shubman Gill (UKN),Matthew Wade (WK),Abhinav Manohar (AR),Vijay Shankar (AR),Rahul Tewatia (AR),M Shahrukh Khan (UKN),Rashid Khan (AR),Noor Ahmad (BL),Umesh Yadav (BL),Spencer Johnson (BL),Mohit Sharma (BL)","Shubman Gill,Sai Sudharsan","Rashid Khan,Umesh Yadav",10 April 2024 - night match (20-over match),Kumar Dharmasena,Vinod Seshan,KN Ananthapadmanabhan,Prakash Bhatt,Vaibhav Dhokre
2024,1426263,Mumbai Indians v Royal Challengers Bengaluru,MI v RCB,"25th Match (N), Indian Premier League at Mumbai, Apr 11 2024",MI,RCB,MI,BOWL FIRST,196/8,199/3,199/3,196/8,MI,MI won by 7 wkts (27b rem),2024-04-11T14:00Z,2024-04-12T23:59Z,58324,"Wankhede Stadium, Mumbai",Hardik Pandya,Faf du Plessis,Jasprit Bumrah,"Mumbai Indians 2, Royal Challengers Bengaluru 0",False,15.3,199,3,33,20,196,8,26,"Bumrah five-for and express Kishan, SKY fifties take MI to bruising win over RCB. Fifties from du Plessis, Patidar and Karthik took RCB to 196, but MI topped that in just 15.3 overs","Ishan Kishan,Suryakumar Yadav","Jasprit Bumrah,Shreyas Gopal","Ishan Kishan (WK),Rohit Sharma (UKN),Suryakumar Yadav (UKN),Hardik Pandya (AR),Tilak Varma (AR),Tim David (UKN),Mohammad Nabi (AR),Romario Shepherd (AR),Shreyas Gopal (AR),Jasprit Bumrah (BL),Gerald Coetzee (BL),Akash Madhwal (BL)","Virat Kohli (UKN),Faf du Plessis (UKN),Will Jacks (AR),Rajat Patidar (UKN),Glenn Maxwell (AR),Dinesh Karthik (WK),Mahipal Lomror (AR),Saurav Chauhan (UKN),Vijaykumar Vyshak (BL),Akash Deep (AR),Reece Topley (BL),Mohammed Siraj (BL)","Faf du Plessis,Dinesh Karthik","Vijaykumar Vyshak,Will Jacks",11 April 2024 - night match (20-over match),Vineet Kulkarni,Nitin Menon,Virender Sharma,Javagal Srinath,Madanagopal Kuppuraj
2024,1426264,Lucknow Super Giants v Delhi Capitals,LSG v DC,"26th Match (N), Indian Premier League at Lucknow, Apr 12 2024",LSG,DC,LSG,BAT FIRST,167/7,170/4,167/7,170/4,DC,DC won by 6 wkts (11b rem),2024-04-12T14:00Z,2024-04-13T23:59Z,1070094,"Bharat Ratna Shri Atal Bihari Vajpayee Ekana Cricket Stadium, Lucknow",KL Rahul,Rishabh Pant,Kuldeep Yadav,"Delhi Capitals 2, Lucknow Super Giants 0",False,20,167,7,19,18.1,170,4,22,"Kuldeep, Fraser-McGurk and Pant join forces to lift Capitals out of last spot. Delhi Capitals, on a run of four defeats in five before the game, ended Lucknow Super Giants' stranglehold on 160-plus defences","Ayush Badoni,KL Rahul","Ravi Bishnoi,Naveen-ul-Haq","Quinton de Kock (UKN),KL Rahul (WK),Devdutt Padikkal (UKN),Marcus Stoinis (AR),Nicholas Pooran (UKN),Deepak Hooda (AR),Ayush Badoni (UKN),Krunal Pandya (AR),Arshad Khan (BL),Ravi Bishnoi (BL),Naveen-ul-Haq (BL),Yash Thakur (BL)","Prithvi Shaw (UKN),David Warner (UKN),Jake Fraser-McGurk (UKN),Rishabh Pant (WK),Tristan Stubbs (UKN),Shai Hope (UKN),Axar Patel (AR),Kuldeep Yadav (BL),Mukesh Kumar (BL),Ishant Sharma (BL),Abishek Porel (UKN),Khaleel Ahmed (BL)","Jake Fraser-McGurk,Rishabh Pant","Kuldeep Yadav,Khaleel Ahmed",12 April 2024 - night match (20-over match),Yeshwant Barde,Rohan Pandit,Bruce Oxenford,Manu Nayar,Mohit Krishnadas
2024,1426265,Punjab Kings v Rajasthan Royals,PBKS v RR,"27th Match (N), Indian Premier League at Mohali, Apr 13 2024",PBKS,RR,RR,BOWL FIRST,147/8,152/7,147/8,152/7,RR,RR won by 3 wkts (1b rem),2024-04-13T14:00Z,2024-04-14T23:59Z,1290799,"Maharaja Yadavindra Singh International Cricket Stadium, Mullanpur",Sam Curran,Sanju Samson,Shimron Hetmyer,"Rajasthan Royals 2, Punjab Kings 0",False,20,147,8,15,19.5,152,7,17,"Hetmyer the hero as Royals take low-scoring thriller. Despite an excellent 19th over from Curran and a good effort from Arshdeep, Hetmyer guided Royals home with an unbeaten ten-ball 27","Ashutosh Sharma,Jitesh Sharma","Kagiso Rabada,Sam Curran","Atharva Taide (AR),Jonny Bairstow (UKN),Prabhsimran Singh (UKN),Sam Curran (AR),Jitesh Sharma (WK),Shashank Singh (AR),Liam Livingstone (AR),Ashutosh Sharma (AR),Harpreet Brar (BL),Harshal Patel (BL),Kagiso Rabada (BL),Arshdeep Singh (BL)","Yashasvi Jaiswal (UKN),Tanush Kotian (AR),Sanju Samson (WK),Riyan Parag (UKN),Dhruv Jurel (UKN),Shimron Hetmyer (UKN),Rovman Powell (UKN),Keshav Maharaj (BL),Trent Boult (BL),Avesh Khan (BL),Yuzvendra Chahal (BL),Kuldeep Sen (BL)","Yashasvi Jaiswal,Shimron Hetmyer","Keshav Maharaj,Avesh Khan",13 April 2024 - night match (20-over match),Anil Chaudhary,Tapan Sharma,Jayaraman Madanagopal,Narayanan Kutty,Pranav Joshi
2024,1426266,Kolkata Knight Riders v Lucknow Super Giants,KKR v LSG,"28th Match (D/N), Indian Premier League at Kolkata, Apr 14 2024",KKR,LSG,KKR,BOWL FIRST,161/7,162/2,162/2,161/7,KKR,KKR won by 8 wkts (26b rem),2024-04-14T10:00Z,2024-04-15T23:59Z,57980,"Eden Gardens, Kolkata",Shreyas Iyer,KL Rahul,Phil Salt,"Kolkata Knight Riders 2, Lucknow Super Giants 0",False,15.4,162,2,25,20,161,7,20,"Phil Salt and Mitchell Starc headline KKR's thumping win. The KKR spinners meanwhile stifled the opposition batters as usual, ensuring the chase was far from demanding","Phil Salt,Shreyas Iyer","Mitchell Starc,Andre Russell","Phil Salt (WK),Sunil Narine (AR),Angkrish Raghuvanshi (UKN),Shreyas Iyer (UKN),Venkatesh Iyer (AR),Andre Russell (AR),Ramandeep Singh (UKN),Mitchell Starc (BL),Vaibhav Arora (BL),Harshit Rana (BL),Rinku Singh (UKN),Varun Chakravarthy (BL)","Quinton de Kock (UKN),KL Rahul (WK),Deepak Hooda (AR),Ayush Badoni (UKN),Marcus Stoinis (AR),Nicholas Pooran (UKN),Krunal Pandya (AR),Arshad Khan (BL),Mohsin Khan (BL),Ravi Bishnoi (BL),Shamar Joseph (BL),Yash Thakur (BL)","Nicholas Pooran,KL Rahul","Mohsin Khan,Shamar Joseph",14 April 2024 - day/night match (20-over match),Akshay Totre,Vinod Seshan,KN Ananthapadmanabhan,Amit Sharma,Vaibhav Dhokre
2024,1426267,Mumbai Indians v Chennai Super Kings,MI v CSK,"29th Match (N), Indian Premier League at Mumbai, Apr 14 2024",MI,CSK,MI,BOWL FIRST,206/4,186/6,186/6,206/4,CSK,CSK won by 20 runs,2024-04-14T14:00Z,2024-04-15T23:59Z,58324,"Wankhede Stadium, Mumbai",Hardik Pandya,Ruturaj Gaikwad,Matheesha Pathirana,"Chennai Super Kings 2, Mumbai Indians 0",False,20,186,6,27,20,206,4,30,Pathirana's four-for overshadows Rohit's ton as Mumbai go down. Mumbai's innings looked like it was going smoothly but some sensational defensive bowling helped CSK seal the game,"Rohit Sharma,Tilak Varma","Hardik Pandya,Shreyas Gopal","Rohit Sharma (UKN),Ishan Kishan (WK),Suryakumar Yadav (UKN),Tilak Varma (AR),Hardik Pandya (AR),Tim David (UKN),Romario Shepherd (AR),Mohammad Nabi (AR),Shreyas Gopal (AR),Jasprit Bumrah (BL),Gerald Coetzee (BL),Akash Madhwal (BL)","Ajinkya Rahane (UKN),Rachin Ravindra (AR),Ruturaj Gaikwad (UKN),Shivam Dube (AR),Daryl Mitchell (AR),MS Dhoni (WK),Ravindra Jadeja (AR),Sameer Rizvi (UKN),Shardul Thakur (BL),Tushar Deshpande (BL),Mustafizur Rahman (BL),Matheesha Pathirana (BL)","Ruturaj Gaikwad,Shivam Dube","Matheesha Pathirana,Tushar Deshpande",14 April 2024 - night match (20-over match),Saiyed Khalid,Nitin Menon,Virender Sharma,Javagal Srinath,Madanagopal Kuppuraj
2024,1426268,Royal Challengers Bengaluru v Sunrisers Hyderabad,RCB v SRH,"30th Match (N), Indian Premier League at Bengaluru, Apr 15 2024",RCB,SRH,RCB,BOWL FIRST,287/3,262/7,262/7,287/3,SRH,SRH won by 25 runs,2024-04-15T14:00Z,2024-04-16T23:59Z,57897,"M.Chinnaswamy Stadium, Bengaluru",Faf du Plessis,Pat Cummins,Travis Head,"Sunrisers Hyderabad 2, Royal Challengers Bengaluru 0",False,20,262,7,40,20,287,3,41,"Head, Klaasen play decisive hands in Chinnaswamy big bash. Sunrisers bested RCB on a night that produced the biggest IPL total and the highest match aggregate in all T20s","Dinesh Karthik,Faf du Plessis","Lockie Ferguson,Reece Topley","Virat Kohli (UKN),Faf du Plessis (UKN),Will Jacks (AR),Rajat Patidar (UKN),Saurav Chauhan (UKN),Dinesh Karthik (WK),Mahipal Lomror (AR),Anuj Rawat (UKN),Vijaykumar Vyshak (BL),Reece Topley (BL),Lockie Ferguson (BL),Yash Dayal (BL)","Abhishek Sharma (AR),Travis Head (UKN),Heinrich Klaasen (WK),Aiden Markram (UKN),Abdul Samad (UKN),Shahbaz Ahmed (AR),Pat Cummins (BL),Bhuvneshwar Kumar (BL),Jaydev Unadkat (BL),T Natarajan (BL),Nitish Kumar Reddy (AR),Mayank Markande (BL)","Travis Head,Heinrich Klaasen","Pat Cummins,Mayank Markande",15 April 2024 - night match (20-over match),Anil Chaudhary,Rohan Pandit,Bruce Oxenford,Manu Nayar,Mohit Krishnadas
2024,1426269,Kolkata Knight Riders v Rajasthan Royals,KKR v RR,"31st Match (N), Indian Premier League at Kolkata, Apr 16 2024",KKR,RR,RR,BOWL FIRST,223/6,224/8,223/6,224/8,RR,RR won by 2 wkts (0b rem),2024-04-16T14:00Z,2024-04-17T23:59Z,57980,"Eden Gardens, Kolkata",Shreyas Iyer,Sanju Samson,Jos Buttler,"Rajasthan Royals 2, Kolkata Knight Riders 0",False,20,223,6,33,20,224,8,32,"Buttler's 107* tops Narine's 109 as Royals ace record chase against KKR. Royals' show equalled the record for the highest successful chase in IPL history, which they had held since 2020","Sunil Narine,Angkrish Raghuvanshi","Sunil Narine,Varun Chakravarthy","Phil Salt (WK),Sunil Narine (AR),Angkrish Raghuvanshi (UKN),Shreyas Iyer (UKN),Andre Russell (AR),Rinku Singh (UKN),Venkatesh Iyer (AR),Ramandeep Singh (UKN),Mitchell Starc (BL),Varun Chakravarthy (BL),Harshit Rana (BL),Vaibhav Arora (BL)","Yashasvi Jaiswal (UKN),Jos Buttler (UKN),Sanju Samson (WK),Riyan Parag (UKN),Dhruv Jurel (UKN),Ravichandran Ashwin (AR),Shimron Hetmyer (UKN),Rovman Powell (UKN),Trent Boult (BL),Avesh Khan (BL),Yuzvendra Chahal (BL),Kuldeep Sen (BL)","Jos Buttler,Riyan Parag","Avesh Khan,Kuldeep Sen",16 April 2024 - night match (20-over match),Ulhas Gandhe,Michael Gough,KN Ananthapadmanabhan,Amit Sharma,Vaibhav Dhokre
2024,1426270,Gujarat Titans v Delhi Capitals,GT v DC,"32nd Match (N), Indian Premier League at Ahmedabad, Apr 17 2024",GT,DC,DC,BOWL FIRST,89,92/4,89,92/4,DC,DC won by 6 wkts (67b rem),2024-04-17T14:00Z,2024-04-18T23:59Z,57851,"Narendra Modi Stadium, Motera, Ahmedabad",Shubman Gill,Rishabh Pant,Rishabh Pant,"Delhi Capitals 2, Gujarat Titans 0",False,17.3,89,10,9,8.5,92,4,15,A Capital win after Titans routed for season's lowest total. Titans were bundled out for 89 following which Capitals finished the chase in 53 balls,"Rashid Khan,Sai Sudharsan","Sandeep Warrier,Rashid Khan","Wriddhiman Saha (WK),Shubman Gill (UKN),Sai Sudharsan (UKN),David Miller (UKN),Abhinav Manohar (AR),Rahul Tewatia (AR),M Shahrukh Khan (UKN),Rashid Khan (AR),Mohit Sharma (BL),Noor Ahmad (BL),Spencer Johnson (BL),Sandeep Warrier (BL)","Prithvi Shaw (UKN),Jake Fraser-McGurk (UKN),Abishek Porel (UKN),Shai Hope (UKN),Rishabh Pant (WK),Sumit Kumar (AR),Tristan Stubbs (UKN),Axar Patel (AR),Kuldeep Yadav (BL),Ishant Sharma (BL),Mukesh Kumar (BL),Khaleel Ahmed (BL)","Jake Fraser-McGurk,Shai Hope","Mukesh Kumar,Ishant Sharma",17 April 2024 - night match (20-over match),Nikhil Patwardhan,Virender Sharma,Jayaraman Madanagopal,Narayanan Kutty,Pranav Joshi
2024,1426271,Punjab Kings v Mumbai Indians,PBKS v MI,"33rd Match (N), Indian Premier League at Mohali, Apr 18 2024",PBKS,MI,KXIP,BOWL FIRST,192/7,183,183,192/7,MI,MI won by 9 runs,2024-04-18T14:00Z,2024-04-19T23:59Z,1290799,"Maharaja Yadavindra Singh International Cricket Stadium, Mullanpur",Sam Curran,Hardik Pandya,Jasprit Bumrah,"Mumbai Indians 2, Punjab Kings 0",False,19.1,183,10,22,20,192,7,24,Ashutosh blinder not enough as Kings fall short in IPL classic. Bumrah and Coetzee overcame a spirited Kings' chase as Mumbai moved from ninth to seventh on the points table,"Ashutosh Sharma,Shashank Singh","Harshal Patel,Sam Curran","Sam Curran (AR),Prabhsimran Singh (UKN),Rilee Rossouw (UKN),Liam Livingstone (AR),Harpreet Singh (UKN),Shashank Singh (AR),Jitesh Sharma (WK),Ashutosh Sharma (AR),Harpreet Brar (BL),Harshal Patel (BL),Kagiso Rabada (BL),Arshdeep Singh (BL)","Ishan Kishan (WK),Rohit Sharma (UKN),Suryakumar Yadav (UKN),Tilak Varma (AR),Hardik Pandya (AR),Tim David (UKN),Romario Shepherd (AR),Mohammad Nabi (AR),Gerald Coetzee (BL),Shreyas Gopal (AR),Jasprit Bumrah (BL),Akash Madhwal (BL)","Suryakumar Yadav,Rohit Sharma","Jasprit Bumrah,Gerald Coetzee",18 April 2024 - night match (20-over match),Vineet Kulkarni,Nand Kishore,Nitin Menon,Sanjay Verma,Keyur Kelkar
2024,1426272,Lucknow Super Giants v Chennai Super Kings,LSG v CSK,"34th Match (N), Indian Premier League at Lucknow, Apr 19 2024",LSG,CSK,LSG,BOWL FIRST,176/6,180/2,180/2,176/6,LSG,LSG won by 8 wkts (6b rem),2024-04-19T14:00Z,2024-04-20T23:59Z,1070094,"Bharat Ratna Shri Atal Bihari Vajpayee Ekana Cricket Stadium, Lucknow",KL Rahul,Ruturaj Gaikwad,KL Rahul,"Lucknow Super Giants 2, Chennai Super Kings 0",False,19,180,2,23,20,176,6,21,"Rahul leads LSG's cruise past CSK despite Dhoni fireworks. Both teams are now at eight points, level with KKR and SRH and only behind Rajasthan Royals","KL Rahul,Quinton de Kock","Krunal Pandya,Marcus Stoinis","Quinton de Kock (UKN),KL Rahul (WK),Nicholas Pooran (UKN),Marcus Stoinis (AR),Deepak Hooda (AR),Ayush Badoni (UKN),Krunal Pandya (AR),Matt Henry (BL),Ravi Bishnoi (BL),Mohsin Khan (BL),Yash Thakur (BL)","Ajinkya Rahane (UKN),Rachin Ravindra (AR),Ruturaj Gaikwad (UKN),Ravindra Jadeja (AR),Shivam Dube (AR),Sameer Rizvi (UKN),Moeen Ali (AR),MS Dhoni (WK),Deepak Chahar (BL),Tushar Deshpande (BL),Mustafizur Rahman (BL),Matheesha Pathirana (BL)","Ravindra Jadeja,Ajinkya Rahane","Matheesha Pathirana,Mustafizur Rahman",19 April 2024 - night match (20-over match),Anil Chaudhary,Rohan Pandit,Bruce Oxenford,Manu Nayar,Rajesh Kannan
2024,1426273,Delhi Capitals v Sunrisers Hyderabad,DC v SRH,"35th Match (N), Indian Premier League at Delhi, Apr 20 2024",DC,SRH,DC,BOWL FIRST,266/7,199,199,266/7,SRH,SRH won by 67 runs,2024-04-20T14:00Z,2024-04-21T23:59Z,58040,"Arun Jaitley Stadium, Delhi",Rishabh Pant,Pat Cummins,Travis Head,"Sunrisers Hyderabad 2, Delhi Capitals 0",False,19.1,199,10,31,20,266,7,40,"Head, Abhishek, Shahbaz, Natarajan break records and help SRH go second. Sunrisers had 300 within their sights at the start but even 266 proved to be too big for Capitals","Jake Fraser-McGurk,Rishabh Pant","Kuldeep Yadav,Axar Patel","Prithvi Shaw (UKN),David Warner (UKN),Jake Fraser-McGurk (UKN),Abishek Porel (UKN),Tristan Stubbs (UKN),Rishabh Pant (WK),Lalit Yadav (AR),Axar Patel (AR),Anrich Nortje (BL),Kuldeep Yadav (BL),Mukesh Kumar (BL),Khaleel Ahmed (BL)","Travis Head (UKN),Abhishek Sharma (AR),Aiden Markram (UKN),Heinrich Klaasen (WK),Nitish Kumar Reddy (AR),Shahbaz Ahmed (AR),Abdul Samad (UKN),Pat Cummins (BL),Washington Sundar (AR),Bhuvneshwar Kumar (BL),T Natarajan (BL),Mayank Markande (BL)","Travis Head,Shahbaz Ahmed","T Natarajan,Nitish Kumar Reddy",20 April 2024 - night match (20-over match),Jayaraman Madanagopal,Navdeep Singh,Tapan Sharma,Sanjay Verma,Kannur Swaroopanand
2024,1426274,Kolkata Knight Riders v Royal Challengers Bengaluru,KKR v RCB,"36th Match (D/N), Indian Premier League at Kolkata, Apr 21 2024",KKR,RCB,RCB,BOWL FIRST,222/6,221,222/6,221,KKR,KKR won by 1 run,2024-04-21T10:00Z,2024-04-22T23:59Z,57980,"Eden Gardens, Kolkata",Shreyas Iyer,Faf du Plessis,Andre Russell,"Kolkata Knight Riders 2, Royal Challengers Bengaluru 0",False,20,222,6,34,20,221,10,33,"KKR survive Karn scare to win by one run. With 21 runs to get off the final over, Karn nearly pulled off a miracle, but Knight Riders and Phil Salt held their nerve to effect a run-out off the last ball","Shreyas Iyer,Phil Salt","Andre Russell,Harshit Rana","Phil Salt (WK),Sunil Narine (AR),Angkrish Raghuvanshi (UKN),Venkatesh Iyer (AR),Shreyas Iyer (UKN),Rinku Singh (UKN),Andre Russell (AR),Ramandeep Singh (UKN),Mitchell Starc (BL),Varun Chakravarthy (BL),Harshit Rana (BL),Suyash Sharma (BL)","Virat Kohli (UKN),Faf du Plessis (UKN),Will Jacks (AR),Rajat Patidar (UKN),Cameron Green (AR),Suyash Prabhudessai (AR),Mahipal Lomror (AR),Dinesh Karthik (WK),Karn Sharma (BL),Mohammed Siraj (BL),Lockie Ferguson (BL),Yash Dayal (BL)","Will Jacks,Rajat Patidar","Cameron Green,Yash Dayal",21 April 2024 - day/night match (20-over match),Akshay Totre,Vinod Seshan,Michael Gough,Amit Sharma,Abhijeet Bengeri
2024,1426275,Punjab Kings v Gujarat Titans,PBKS v GT,"37th Match (N), Indian Premier League at Mohali, Apr 21 2024",PBKS,GT,KXIP,BAT FIRST,142,146/7,142,146/7,GT,GT won by 3 wkts (5b rem),2024-04-21T14:00Z,2024-04-22T23:59Z,1290799,"Maharaja Yadavindra Singh International Cricket Stadium, Mullanpur",Sam Curran,Shubman Gill,Sai Kishore,"Gujarat Titans 2, Punjab Kings 0",False,20,142,10,17,19.1,146,7,18,"Sai Kishore's four-for, Tewatia's finishing act push Titans towards top half. The Titans spinners combined for 7 for 68 to restrict Kings to a modest score","Prabhsimran Singh,Harpreet Brar","Harshal Patel,Liam Livingstone","Sam Curran (AR),Prabhsimran Singh (UKN),Rilee Rossouw (UKN),Jitesh Sharma (WK),Liam Livingstone (AR),Shashank Singh (AR),Ashutosh Sharma (AR),Harpreet Singh (UKN),Harpreet Brar (BL),Harshal Patel (BL),Kagiso Rabada (BL),Arshdeep Singh (BL)","Wriddhiman Saha (WK),Shubman Gill (UKN),Sai Sudharsan (UKN),David Miller (UKN),Azmatullah Omarzai (AR),Rahul Tewatia (AR),M Shahrukh Khan (UKN),Rashid Khan (AR),Sai Kishore (BL),Noor Ahmad (BL),Mohit Sharma (BL),Sandeep Warrier (BL)","Rahul Tewatia,Shubman Gill","Sai Kishore,Noor Ahmad",21 April 2024 - night match (20-over match),Vineet Kulkarni,Nand Kishore,Saiyed Khalid,Javagal Srinath,Keyur Kelkar
2024,1426276,Rajasthan Royals v Mumbai Indians,RR v MI,"38th Match (N), Indian Premier League at Jaipur, Apr 22 2024",RR,MI,MI,BAT FIRST,179/9,183/1,183/1,179/9,RR,RR won by 9 wkts (8b rem),2024-04-22T14:00Z,2024-04-23T23:59Z,58162,"Sawai Mansingh Stadium, Jaipur",Sanju Samson,Hardik Pandya,Sandeep Sharma,"Rajasthan Royals 2, Mumbai Indians 0",False,18.4,183,1,26,20,179,9,22,"Sandeep Sharma five-for, Yashasvi Jaiswal ton hand Royals comfortable win. Royals signed off from the Jaipur leg of their campaign with a seventh win in eight matches to cement their table-topping status","Yashasvi Jaiswal,Sanju Samson","Sandeep Sharma,Trent Boult","Yashasvi Jaiswal (UKN),Jos Buttler (UKN),Sanju Samson (WK),Rovman Powell (UKN),Riyan Parag (UKN),Shimron Hetmyer (UKN),Dhruv Jurel (UKN),Ravichandran Ashwin (AR),Trent Boult (BL),Avesh Khan (BL),Sandeep Sharma (BL),Yuzvendra Chahal (BL)","Rohit Sharma (UKN),Ishan Kishan (WK),Suryakumar Yadav (UKN),Tilak Varma (AR),Mohammad Nabi (AR),Nehal Wadhera (UKN),Hardik Pandya (AR),Tim David (UKN),Gerald Coetzee (BL),Piyush Chawla (AR),Jasprit Bumrah (BL),Nuwan Thushara (BL)","Tilak Varma,Nehal Wadhera","Piyush Chawla,Mohammad Nabi",22 April 2024 - night match (20-over match),Anil Chaudhary,Saidharshan Kumar,Bruce Oxenford,Manu Nayar,Rajesh Kannan
