season,id,name,short_name,description,home_team,away_team,toss_won,decision,1st_inning_score,2nd_inning_score,home_score,away_score,winner,result,start_date,end_date,venue_id,venue_name,home_captain,away_captain,pom,points,super_over,home_overs,home_runs,home_wickets,home_boundaries,away_overs,away_runs,away_wickets,away_boundaries,highlights,home_key_batsman,home_key_bowler,home_playx1,away_playx1,away_key_batsman,away_key_bowler,match_days,umpire1,umpire2,tv_umpire,referee,reserve_umpire
2024,1426277,Chennai Super Kings v Lucknow Super Giants,CSK v LSG,"39th Match (N), Indian Premier League at Chennai, Apr 23 2024",CSK,LSG,LSG,BOWL FIRST,210/4,213/4,210/4,213/4,LSG,LSG won by 6 wkts (3b rem),2024-04-23T14:00Z,2024-04-24T23:59Z,58008,"MA Chidambaram Stadium, Chepauk, Chennai",Ruturaj Gaikwad,KL Rahul,Marcus Stoinis,"Lucknow Super Giants 2, Chennai Super Kings 0",False,20,210,4,29,19.3,213,4,29,Marcus Stoinis silences Chepauk with hundred in record chase. Lucknow Super Giants beat the Chennai Super Kings for the second time in the space of five days,"Ruturaj Gaikwad,Shivam Dube","Matheesha Pathirana,Deepak Chahar","Ajinkya Rahane (UKN),Ruturaj Gaikwad (UKN),Daryl Mitchell (AR),Ravindra Jadeja (AR),Shivam Dube (AR),MS Dhoni (WK),Moeen Ali (AR),Deepak Chahar (BL),Tushar Deshpande (BL),Mustafizur Rahman (BL),Matheesha Pathirana (BL),Shardul Thakur (BL)","Quinton de Kock (UKN),KL Rahul (WK),Marcus Stoinis (AR),Devdutt Padikkal (UKN),Nicholas Pooran (UKN),Deepak Hooda (AR),Ayush Badoni (UKN),Krunal Pandya (AR),Matt Henry (BL),Ravi Bishnoi (BL),Mohsin Khan (BL),Yash Thakur (BL)","Marcus Stoinis,Nicholas Pooran","Matt Henry,Yash Thakur",23 April 2024 - night match (20-over match),Nikhil Patwardhan,Tapan Sharma,Jayaraman Madanagopal,Sanjay Verma,Kannur Swaroopanand
2024,1426278,Delhi Capitals v Gujarat Titans,DC v GT,"40th Match (N), Indian Premier League at Delhi, Apr 24 2024",DC,GT,GT,BOWL FIRST,224/4,220/8,224/4,220/8,DC,DC won by 4 runs,2024-04-24T14:00Z,2024-04-25T23:59Z,58040,"Arun Jaitley Stadium, Delhi",Rishabh Pant,Shubman Gill,Rishabh Pant,"Delhi Capitals 2, Gujarat Titans 0",False,20,224,4,34,20,220,8,32,Pant and Axar star as Capitals cling on to win topsy-turvy thriller over Titans. Rashid nearly took Titans home in pursuit of 225 but Mukesh held his nerve to defend 19 off the last over,"Rishabh Pant,Axar Patel","Rasikh Salam,Kuldeep Yadav","Prithvi Shaw (UKN),Jake Fraser-McGurk (UKN),Axar Patel (AR),Shai Hope (UKN),Rishabh Pant (WK),Tristan Stubbs (UKN),Abishek Porel (UKN),Kuldeep Yadav (BL),Anrich Nortje (BL),Khaleel Ahmed (BL),Mukesh Kumar (BL),Rasikh Salam (BL)","Wriddhiman Saha (WK),Shubman Gill (UKN),Sai Sudharsan (UKN),Azmatullah Omarzai (AR),David Miller (UKN),M Shahrukh Khan (UKN),Rahul Tewatia (AR),Rashid Khan (AR),Sai Kishore (BL),Mohit Sharma (BL),Noor Ahmad (BL),Sandeep Warrier (BL)","Sai Sudharsan,David Miller","Sandeep Warrier,Noor Ahmad",24 April 2024 - night match (20-over match),KN Ananthapadmanabhan,Ulhas Gandhe,Akshay Totre,Amit Sharma,Abhijeet Bengeri
2024,1426279,Sunrisers Hyderabad v Royal Challengers Bengaluru,SRH v RCB,"41st Match (N), Indian Premier League at Hyderabad, Apr 25 2024",SRH,RCB,RCB,BAT FIRST,206/7,171/8,171/8,206/7,RCB,RCB won by 35 runs,2024-04-25T14:00Z,2024-04-26T23:59Z,58142,"Rajiv Gandhi International Stadium, Uppal, Hyderabad",Pat Cummins,Faf du Plessis,Rajat Patidar,"Royal Challengers Bengaluru 2, Sunrisers Hyderabad 0",False,20,171,8,19,20,206,7,26,"Patidar, Green, spinners thump SRH to end six-match losing streak. Kohli top-scored for RCB but his 51 off 43 saw a slowdown after the powerplay","Shahbaz Ahmed,Abhishek Sharma","Jaydev Unadkat,T Natarajan","Abhishek Sharma (AR),Travis Head (UKN),Aiden Markram (UKN),Nitish Kumar Reddy (AR),Heinrich Klaasen (WK),Shahbaz Ahmed (AR),Abdul Samad (UKN),Pat Cummins (BL),Bhuvneshwar Kumar (BL),Jaydev Unadkat (BL),Mayank Markande (BL),T Natarajan (BL)","Virat Kohli (UKN),Faf du Plessis (UKN),Will Jacks (AR),Rajat Patidar (UKN),Cameron Green (AR),Mahipal Lomror (AR),Dinesh Karthik (WK),Swapnil Singh (BL),Karn Sharma (BL),Lockie Ferguson (BL),Yash Dayal (BL),Mohammed Siraj (BL)","Virat Kohli,Rajat Patidar","Cameron Green,Karn Sharma",25 April 2024 - night match (20-over match),Saiyed Khalid,Nitin Menon,Virender Sharma,Javagal Srinath,Keyur Kelkar
2024,1426280,Kolkata Knight Riders v Punjab Kings,KKR v PBKS,"42nd Match (N), Indian Premier League at Kolkata, Apr 26 2024",KKR,PBKS,KXIP,BOWL FIRST,261/6,262/2,261/6,262/2,PBKS,PBKS won by 8 wkts (8b rem),2024-04-26T14:00Z,2024-04-27T23:59Z,57980,"Eden Gardens, Kolkata",Shreyas Iyer,Sam Curran,Jonny Bairstow,"Punjab Kings 2, Kolkata Knight Riders 0",False,20,261,6,40,18.4,262,2,39,"Bairstow bests Narine as Punjab Kings pull off record T20 chase. Chasing 262, PBKS reached their target with eight balls to spare on a night of unstoppable hitting","Phil Salt,Sunil Narine","Sunil Narine,Ramandeep Singh","Phil Salt (WK),Sunil Narine (AR),Venkatesh Iyer (AR),Andre Russell (AR),Shreyas Iyer (UKN),Rinku Singh (UKN),Ramandeep Singh (UKN),Angkrish Raghuvanshi (UKN),Varun Chakravarthy (BL),Harshit Rana (BL),Dushmantha Chameera (BL),Anukul Roy (AR)","Prabhsimran Singh (UKN),Jonny Bairstow (UKN),Rilee Rossouw (UKN),Shashank Singh (AR),Sam Curran (AR),Jitesh Sharma (WK),Ashutosh Sharma (AR),Harpreet Brar (BL),Harshal Patel (BL),Kagiso Rabada (BL),Rahul Chahar (BL),Arshdeep Singh (BL)","Jonny Bairstow,Shashank Singh","Arshdeep Singh,Rahul Chahar",26 April 2024 - night match (20-over match),Yeshwant Barde,Anil Chaudhary,Rohan Pandit,Sanjay Verma,Rajesh Kannan
2024,1426281,Delhi Capitals v Mumbai Indians,DC v MI,"43rd Match (D/N), Indian Premier League at Delhi, Apr 27 2024",DC,MI,MI,BOWL FIRST,257/4,247/9,257/4,247/9,DC,DC won by 10 runs,2024-04-27T10:00Z,2024-04-28T23:59Z,58040,"Arun Jaitley Stadium, Delhi",Rishabh Pant,Hardik Pandya,Jake Fraser-McGurk,"Delhi Capitals 2, Mumbai Indians 0",False,20,257,4,39,20,247,9,35,"Fraser-McGurk's 27-ball 84 and Rasikh Salam's 3 for 34 lift Capitals to fifth place. Chasing a big target, MI were in the hunt courtesy Tilak Varma, Hardik Pandya and Tim David, but they fell short in the end","Jake Fraser-McGurk,Tristan Stubbs","Rasikh Salam,Mukesh Kumar","Jake Fraser-McGurk (UKN),Abishek Porel (UKN),Shai Hope (UKN),Rishabh Pant (WK),Tristan Stubbs (UKN),Axar Patel (AR),Kumar Kushagra (UKN),Kuldeep Yadav (BL),Lizaad Williams (BL),Khaleel Ahmed (BL),Mukesh Kumar (BL),Rasikh Salam (BL)","Ishan Kishan (WK),Rohit Sharma (UKN),Suryakumar Yadav (UKN),Tilak Varma (AR),Hardik Pandya (AR),Nehal Wadhera (UKN),Tim David (UKN),Mohammad Nabi (AR),Piyush Chawla (AR),Luke Wood (BL),Jasprit Bumrah (BL),Nuwan Thushara (BL)","Tilak Varma,Hardik Pandya","Jasprit Bumrah,Mohammad Nabi",27 April 2024 - day/night match (20-over match),Navdeep Singh,Nikhil Patwardhan,Jayaraman Madanagopal,Narayanan Kutty,Kannur Swaroopanand
2024,1426282,Lucknow Super Giants v Rajasthan Royals,LSG v RR,"44th Match (N), Indian Premier League at Lucknow, Apr 27 2024",LSG,RR,RR,BOWL FIRST,196/5,199/3,196/5,199/3,RR,RR won by 7 wkts (6b rem),2024-04-27T14:00Z,2024-04-28T23:59Z,1070094,"Bharat Ratna Shri Atal Bihari Vajpayee Ekana Cricket Stadium, Lucknow",KL Rahul,Sanju Samson,Sanju Samson,"Rajasthan Royals 2, Lucknow Super Giants 0",False,20,196,5,22,19,199,3,28,Samson and Jurel seal Royals' eighth win in nine games. They extended their lead at the top of the league and are six points clear of KKR in second place,"KL Rahul,Deepak Hooda","Marcus Stoinis,Amit Mishra","Quinton de Kock (UKN),KL Rahul (WK),Marcus Stoinis (AR),Deepak Hooda (AR),Nicholas Pooran (UKN),Ayush Badoni (UKN),Krunal Pandya (AR),Matt Henry (BL),Ravi Bishnoi (BL),Mohsin Khan (BL),Yash Thakur (BL),Amit Mishra (BL)","Yashasvi Jaiswal (UKN),Jos Buttler (UKN),Sanju Samson (WK),Riyan Parag (UKN),Dhruv Jurel (UKN),Rovman Powell (UKN),Shimron Hetmyer (UKN),Ravichandran Ashwin (AR),Trent Boult (BL),Avesh Khan (BL),Sandeep Sharma (BL),Yuzvendra Chahal (BL)","Sanju Samson,Dhruv Jurel","Sandeep Sharma,Ravichandran Ashwin",27 April 2024 - night match (20-over match),KN Ananthapadmanabhan,Michael Gough,Vinod Seshan,Amit Sharma,Abhijeet Bengeri
2024,1426283,Gujarat Titans v Royal Challengers Bengaluru,GT v RCB,"45th Match (D/N), Indian Premier League at Ahmedabad, Apr 28 2024",GT,RCB,RCB,BOWL FIRST,200/3,206/1,200/3,206/1,RCB,RCB won by 9 wkts (24b rem),2024-04-28T10:00Z,2024-04-29T23:59Z,57851,"Narendra Modi Stadium, Motera, Ahmedabad",Shubman Gill,Faf du Plessis,Will Jacks,"Royal Challengers Bengaluru 2, Gujarat Titans 0",False,20,200,3,25,16,206,1,28,Jacks and Kohli ace RCB's 201-run chase in 16 overs against Titans. RCB got their second win in a row and also got an NRR boost,"Sai Sudharsan,M Shahrukh Khan","Sai Kishore,Noor Ahmad","Wriddhiman Saha (WK),Shubman Gill (UKN),Sai Sudharsan (UKN),M Shahrukh Khan (UKN),David Miller (UKN),Azmatullah Omarzai (AR),Rahul Tewatia (AR),Rashid Khan (AR),Sai Kishore (BL),Mohit Sharma (BL),Noor Ahmad (BL),Sandeep Warrier (BL)","Virat Kohli (UKN),Faf du Plessis (UKN),Will Jacks (AR),Rajat Patidar (UKN),Glenn Maxwell (AR),Cameron Green (AR),Dinesh Karthik (WK),Karn Sharma (BL),Mohammed Siraj (BL),Yash Dayal (BL),Swapnil Singh (BL)","Will Jacks,Virat Kohli","Swapnil Singh,Glenn Maxwell",28 April 2024 - day/night match (20-over match),Nitin Menon,Virender Sharma,Vineet Kulkarni,Javagal Srinath,Bhavesh Patel
2024,1426284,Chennai Super Kings v Sunrisers Hyderabad,CSK v SRH,"46th Match (N), Indian Premier League at Chennai, Apr 28 2024",CSK,SRH,SRH,BOWL FIRST,212/3,134,212/3,134,CSK,CSK won by 78 runs,2024-04-28T14:00Z,2024-04-29T23:59Z,58008,"MA Chidambaram Stadium, Chepauk, Chennai",Ruturaj Gaikwad,Pat Cummins,Ruturaj Gaikwad,"Chennai Super Kings 2, Sunrisers Hyderabad 0",False,20,212,3,28,18.5,134,10,13,Ruturaj and Deshpande star as CSK hand SRH a thumping. CSK move to third on the points table but are tied with four other sides on ten points,"Ruturaj Gaikwad,Daryl Mitchell","Tushar Deshpande,Matheesha Pathirana","Ajinkya Rahane (UKN),Ruturaj Gaikwad (UKN),Daryl Mitchell (AR),Shivam Dube (AR),MS Dhoni (WK),Moeen Ali (AR),Ravindra Jadeja (AR),Deepak Chahar (BL),Tushar Deshpande (BL),Mustafizur Rahman (BL),Matheesha Pathirana (BL),Shardul Thakur (BL)","Travis Head (UKN),Abhishek Sharma (AR),Anmolpreet Singh (UKN),Aiden Markram (UKN),Nitish Kumar Reddy (AR),Heinrich Klaasen (WK),Abdul Samad (UKN),Shahbaz Ahmed (AR),Pat Cummins (BL),Bhuvneshwar Kumar (BL),Jaydev Unadkat (BL),T Natarajan (BL)","Aiden Markram,Heinrich Klaasen","Bhuvneshwar Kumar,Jaydev Unadkat",28 April 2024 - night match (20-over match),Rohan Pandit,Saidharshan Kumar,Anil Chaudhary,Sanjay Verma,Keyur Kelkar
2024,1426285,Kolkata Knight Riders v Delhi Capitals,KKR v DC,"47th Match (N), Indian Premier League at Kolkata, Apr 29 2024",KKR,DC,DC,BAT FIRST,153/9,157/3,157/3,153/9,KKR,KKR won by 7 wkts (21b rem),2024-04-29T14:00Z,2024-04-30T23:59Z,57980,"Eden Gardens, Kolkata",Shreyas Iyer,Rishabh Pant,Varun Chakravarthy,"Kolkata Knight Riders 2, Delhi Capitals 0",False,16.3,157,3,23,20,153,9,21,"Varun and Salt star in comprehensive KKR win. The hosts chased down 154 against Delhi Capitals with ease to boost their NRR to 1.096, the best of any team in the competition","Phil Salt,Shreyas Iyer","Varun Chakravarthy,Harshit Rana","Phil Salt (WK),Sunil Narine (AR),Rinku Singh (UKN),Shreyas Iyer (UKN),Venkatesh Iyer (AR),Andre Russell (AR),Ramandeep Singh (UKN),Mitchell Starc (BL),Vaibhav Arora (BL),Harshit Rana (BL),Angkrish Raghuvanshi (UKN),Varun Chakravarthy (BL)","Prithvi Shaw (UKN),Jake Fraser-McGurk (UKN),Abishek Porel (UKN),Shai Hope (UKN),Rishabh Pant (WK),Axar Patel (AR),Tristan Stubbs (UKN),Kumar Kushagra (UKN),Kuldeep Yadav (BL),Rasikh Salam (BL),Lizaad Williams (BL),Khaleel Ahmed (BL)","Kuldeep Yadav,Rishabh Pant","Axar Patel,Lizaad Williams",29 April 2024 - night match (20-over match),Navdeep Singh,Tapan Sharma,Nikhil Patwardhan,Narayanan Kutty,Kannur Swaroopanand
2024,1426286,Lucknow Super Giants v Mumbai Indians,LSG v MI,"48th Match (N), Indian Premier League at Lucknow, Apr 30 2024",LSG,MI,LSG,BOWL FIRST,144/7,145/6,145/6,144/7,LSG,LSG won by 4 wkts (4b rem),2024-04-30T14:00Z,2024-05-01T23:59Z,1070094,"Bharat Ratna Shri Atal Bihari Vajpayee Ekana Cricket Stadium, Lucknow",KL Rahul,Hardik Pandya,Marcus Stoinis,"Lucknow Super Giants 2, Mumbai Indians 0",False,19.2,145,6,17,20,144,7,16,"Stoinis and bowling pack lift LSG to third spot. Mumbai could only muster 144, a total that wasn't anywhere close to enough","Marcus Stoinis,KL Rahul","Mohsin Khan,Naveen-ul-Haq","KL Rahul (WK),Arshin Kulkarni (AR),Marcus Stoinis (AR),Deepak Hooda (AR),Nicholas Pooran (UKN),Ashton Turner (UKN),Ayush Badoni (UKN),Krunal Pandya (AR),Ravi Bishnoi (BL),Naveen-ul-Haq (BL),Mohsin Khan (BL),Mayank Yadav (BL)","Ishan Kishan (WK),Rohit Sharma (UKN),Suryakumar Yadav (UKN),Tilak Varma (AR),Hardik Pandya (AR),Nehal Wadhera (UKN),Tim David (UKN),Mohammad Nabi (AR),Gerald Coetzee (BL),Piyush Chawla (AR),Jasprit Bumrah (BL),Nuwan Thushara (BL)","Nehal Wadhera,Tim David","Hardik Pandya,Mohammad Nabi",30 April 2024 - night match (20-over match),Ulhas Gandhe,Michael Gough,KN Ananthapadmanabhan,Daniel Manohar,Abhijeet Bengeri
2024,1426287,Chennai Super Kings v Punjab Kings,CSK v PBKS,"49th Match (N), Indian Premier League at Chennai, May 1 2024",CSK,PBKS,KXIP,BOWL FIRST,162/7,163/3,162/7,163/3,PBKS,PBKS won by 7 wkts (13b rem),2024-05-01T14:00Z,2024-05-02T23:59Z,58008,"MA Chidambaram Stadium, Chepauk, Chennai",Ruturaj Gaikwad,Sam Curran,Harpreet Brar,"Punjab Kings 2, Chennai Super Kings 0",False,20,162,7,17,17.5,163,3,22,Brar and Chahar go into CSK's den and spin them out. The spinners combined for eight boundary-less overs that fetched them four wickets for just 33 runs,"Ruturaj Gaikwad,Ajinkya Rahane","Richard Gleeson,Shivam Dube","Ajinkya Rahane (UKN),Ruturaj Gaikwad (UKN),Shivam Dube (AR),Ravindra Jadeja (AR),Sameer Rizvi (UKN),Moeen Ali (AR),MS Dhoni (WK),Daryl Mitchell (AR),Deepak Chahar (BL),Shardul Thakur (BL),Richard Gleeson (BL),Mustafizur Rahman (BL)","Prabhsimran Singh (UKN),Jonny Bairstow (UKN),Rilee Rossouw (UKN),Shashank Singh (AR),Sam Curran (AR),Jitesh Sharma (WK),Ashutosh Sharma (AR),Harpreet Brar (BL),Rahul Chahar (BL),Harshal Patel (BL),Kagiso Rabada (BL),Arshdeep Singh (BL)","Jonny Bairstow,Rilee Rossouw","Rahul Chahar,Harpreet Brar",1 May 2024 - night match (20-over match),Saiyed Khalid,Virender Sharma,Nand Kishore,Rajiv Seth,Bhavesh Patel
2024,1426288,Sunrisers Hyderabad v Rajasthan Royals,SRH v RR,"50th Match (N), Indian Premier League at Hyderabad, May 2 2024",SRH,RR,SRH,BAT FIRST,201/3,200/7,201/3,200/7,SRH,SRH won by 1 run,2024-05-02T14:00Z,2024-05-03T23:59Z,58142,"Rajiv Gandhi International Stadium, Uppal, Hyderabad",Pat Cummins,Sanju Samson,Bhuvneshwar Kumar,"Sunrisers Hyderabad 2, Rajasthan Royals 0",False,20,201,3,28,20,200,7,27,"Cummins, Bhuvneshwar help SRH snatch thriller by one run. Cummins bowled a superb 19th over followed by Bhuvneshwar successfully defending 12 in the final over","Nitish Kumar Reddy,Travis Head","Bhuvneshwar Kumar,Pat Cummins","Travis Head (UKN),Abhishek Sharma (AR),Anmolpreet Singh (UKN),Nitish Kumar Reddy (AR),Heinrich Klaasen (WK),Abdul Samad (UKN),Shahbaz Ahmed (AR),Marco Jansen (AR),Pat Cummins (BL),Bhuvneshwar Kumar (BL),T Natarajan (BL),Jaydev Unadkat (BL)","Yashasvi Jaiswal (UKN),Jos Buttler (UKN),Sanju Samson (WK),Riyan Parag (UKN),Shimron Hetmyer (UKN),Rovman Powell (UKN),Dhruv Jurel (UKN),Ravichandran Ashwin (AR),Trent Boult (BL),Avesh Khan (BL),Sandeep Sharma (BL),Yuzvendra Chahal (BL)","Riyan Parag,Yashasvi Jaiswal","Avesh Khan,Sandeep Sharma",2 May 2024 - night match (20-over match),Yeshwant Barde,Anil Chaudhary,Rohan Pandit,Shakti Singh,Keyur Kelkar
2024,1426289,Mumbai Indians v Kolkata Knight Riders,MI v KKR,"51st Match (N), Indian Premier League at Mumbai, May 3 2024",MI,KKR,MI,BOWL FIRST,169,145,145,169,KKR,KKR won by 24 runs,2024-05-03T14:00Z,2024-05-04T23:59Z,58324,"Wankhede Stadium, Mumbai",Hardik Pandya,Shreyas Iyer,Venkatesh Iyer,"Kolkata Knight Riders 2, Mumbai Indians 0",False,18.5,145,10,17,19.5,169,10,21,"Venkatesh, Starc star as KKR break 12-year Wankhede jinx. MI only needed 51 runs off the last five overs, but a superb effort from KKR's bowlers put an end to their hopes","Suryakumar Yadav,Tim David","Jasprit Bumrah,Nuwan Thushara","Ishan Kishan (WK),Rohit Sharma (UKN),Naman Dhir (UKN),Suryakumar Yadav (UKN),Tilak Varma (AR),Nehal Wadhera (UKN),Hardik Pandya (AR),Tim David (UKN),Gerald Coetzee (BL),Piyush Chawla (AR),Jasprit Bumrah (BL),Nuwan Thushara (BL)","Phil Salt (WK),Sunil Narine (AR),Angkrish Raghuvanshi (UKN),Shreyas Iyer (UKN),Venkatesh Iyer (AR),Rinku Singh (UKN),Manish Pandey (UKN),Andre Russell (AR),Ramandeep Singh (UKN),Mitchell Starc (BL),Vaibhav Arora (BL),Varun Chakravarthy (BL)","Venkatesh Iyer,Manish Pandey","Mitchell Starc,Varun Chakravarthy",3 May 2024 - night match (20-over match),Jayaraman Madanagopal,Tapan Sharma,Michael Gough,Pankaj Dharmani,Kannur Swaroopanand
2024,1426290,Royal Challengers Bengaluru v Gujarat Titans,RCB v GT,"52nd Match (N), Indian Premier League at Bengaluru, May 4 2024",RCB,GT,RCB,BOWL FIRST,147,152/6,152/6,147,RCB,RCB won by 4 wkts (38b rem),2024-05-04T14:00Z,2024-05-05T23:59Z,57897,"M.Chinnaswamy Stadium, Bengaluru",Faf du Plessis,Shubman Gill,Mohammed Siraj,"Royal Challengers Bengaluru 2, Gujarat Titans 0",False,13.4,152,6,26,19.3,147,10,22,"Du Plessis, bowlers seal see-saw win for Royal Challengers Bengaluru. RCB lost six wickets for only 25 runs in the chase after a strong start, but Karthik and Swapnil counterpunched to complete the win","Faf du Plessis,Virat Kohli","Yash Dayal,Vijaykumar Vyshak","Virat Kohli (UKN),Faf du Plessis (UKN),Will Jacks (AR),Rajat Patidar (UKN),Glenn Maxwell (AR),Cameron Green (AR),Dinesh Karthik (WK),Swapnil Singh (BL),Karn Sharma (BL),Mohammed Siraj (BL),Vijaykumar Vyshak (BL),Yash Dayal (BL)","Wriddhiman Saha (WK),Shubman Gill (UKN),Sai Sudharsan (UKN),M Shahrukh Khan (UKN),David Miller (UKN),Rahul Tewatia (AR),Rashid Khan (AR),Vijay Shankar (AR),Manav Suthar (AR),Mohit Sharma (BL),Noor Ahmad (BL),Josh Little (BL)","M Shahrukh Khan,Rahul Tewatia","Josh Little,Noor Ahmad",4 May 2024 - night match (20-over match),Akshay Totre,Vinod Seshan,KN Ananthapadmanabhan,Daniel Manohar,Keyur Kelkar
2024,1426291,Punjab Kings v Chennai Super Kings,PBKS v CSK,"53rd Match (D/N), Indian Premier League at Dharamsala, May 5 2024",PBKS,CSK,KXIP,BOWL FIRST,167/9,139/9,139/9,167/9,CSK,CSK won by 28 runs,2024-05-05T10:00Z,2024-05-06T23:59Z,58056,"Himachal Pradesh Cricket Association Stadium, Dharamsala",Sam Curran,Ruturaj Gaikwad,Ravindra Jadeja,"Chennai Super Kings 2, Punjab Kings 0",False,20,139,9,17,20,167,9,20,"Jadeja stars with bat and ball as CSK climb to third. PBKS had dominated proceedings right from the toss, but their batters tumbled from 62 for 2 to 78 for 7 in the 168 chase","Prabhsimran Singh,Shashank Singh","Rahul Chahar,Harshal Patel","Prabhsimran Singh (UKN),Jonny Bairstow (UKN),Rilee Rossouw (UKN),Shashank Singh (AR),Sam Curran (AR),Jitesh Sharma (WK),Ashutosh Sharma (AR),Harpreet Brar (BL),Harshal Patel (BL),Rahul Chahar (BL),Kagiso Rabada (BL),Arshdeep Singh (BL)","Ajinkya Rahane (UKN),Ruturaj Gaikwad (UKN),Daryl Mitchell (AR),Shivam Dube (AR),Moeen Ali (AR),Ravindra Jadeja (AR),Mitchell Santner (AR),Shardul Thakur (BL),MS Dhoni (WK),Tushar Deshpande (BL),Richard Gleeson (BL),Simarjeet Singh (BL)","Ravindra Jadeja,Ruturaj Gaikwad","Ravindra Jadeja,Simarjeet Singh",5 May 2024 - day/night match (20-over match),Vineet Kulkarni,Nand Kishore,Nitin Menon,Rajiv Seth,Bhavesh Patel
2024,1426292,Lucknow Super Giants v Kolkata Knight Riders,LSG v KKR,"54th Match (N), Indian Premier League at Lucknow, May 5 2024",LSG,KKR,LSG,BOWL FIRST,235/6,137,137,235/6,KKR,KKR won by 98 runs,2024-05-05T14:00Z,2024-05-06T23:59Z,1070094,"Bharat Ratna Shri Atal Bihari Vajpayee Ekana Cricket Stadium, Lucknow",KL Rahul,Shreyas Iyer,Sunil Narine,"Kolkata Knight Riders 2, Lucknow Super Giants 0",False,16.1,137,10,17,20,235,6,34,"KKR go top of the table after commanding Narine-led win over LSG. The loss, by a huge 98-run margin, has pushed LSG out of the top four with the playoffs not far away","Marcus Stoinis,KL Rahul","Naveen-ul-Haq,Yudhvir Singh","KL Rahul (WK),Arshin Kulkarni (AR),Marcus Stoinis (AR),Deepak Hooda (AR),Nicholas Pooran (UKN),Ayush Badoni (UKN),Ashton Turner (UKN),Krunal Pandya (AR),Yudhvir Singh (BL),Ravi Bishnoi (BL),Naveen-ul-Haq (BL),Yash Thakur (BL),Mohsin Khan (BL)","Phil Salt (WK),Sunil Narine (AR),Angkrish Raghuvanshi (UKN),Andre Russell (AR),Rinku Singh (UKN),Shreyas Iyer (UKN),Ramandeep Singh (UKN),Venkatesh Iyer (AR),Mitchell Starc (BL),Harshit Rana (BL),Varun Chakravarthy (BL),Vaibhav Arora (BL)","Sunil Narine,Phil Salt","Harshit Rana,Varun Chakravarthy",5 May 2024 - night match (20-over match),Yeshwant Barde,Saidharshan Kumar,Anil Chaudhary,Shakti Singh,Rajesh Kannan
2024,1426293,Mumbai Indians v Sunrisers Hyderabad,MI v SRH,"55th Match (N), Indian Premier League at Mumbai, May 6 2024",MI,SRH,MI,BOWL FIRST,173/8,174/3,174/3,173/8,MI,MI won by 7 wkts (16b rem),2024-05-06T14:00Z,2024-05-07T23:59Z,58324,"Wankhede Stadium, Mumbai",Hardik Pandya,Pat Cummins,Suryakumar Yadav,"Mumbai Indians 2, Sunrisers Hyderabad 0",False,17.2,174,3,27,20,173,8,18,"Suryakumar, Hardik-Chawla crush SRH to raise hopes of mid-table contenders. Hardik and Chawla took three wickets each to help restrict Sunrisers Hyderabad to 173 before Suryakumar and Tilak sealed the chase","Suryakumar Yadav,Tilak Varma","Hardik Pandya,Piyush Chawla","Ishan Kishan (WK),Rohit Sharma (UKN),Naman Dhir (UKN),Suryakumar Yadav (UKN),Tilak Varma (AR),Hardik Pandya (AR),Tim David (UKN),Anshul Kamboj (AR),Piyush Chawla (AR),Jasprit Bumrah (BL),Nuwan Thushara (BL)","Travis Head (UKN),Abhishek Sharma (AR),Mayank Agarwal (UKN),Nitish Kumar Reddy (AR),Heinrich Klaasen (WK),Marco Jansen (AR),Shahbaz Ahmed (AR),Abdul Samad (UKN),Pat Cummins (BL),Sanvir Singh (AR),Bhuvneshwar Kumar (BL),T Natarajan (BL)","Travis Head,Pat Cummins","Bhuvneshwar Kumar,Pat Cummins",6 May 2024 - night match (20-over match),Navdeep Singh,Tapan Sharma,Jayaraman Madanagopal,Pankaj Dharmani,Keyur Kelkar
2024,1426294,Delhi Capitals v Rajasthan Royals,DC v RR,"56th Match (N), Indian Premier League at Delhi, May 7 2024",DC,RR,RR,BOWL FIRST,221/8,201/8,221/8,201/8,DC,DC won by 20 runs,2024-05-07T14:00Z,2024-05-08T23:59Z,58040,"Arun Jaitley Stadium, Delhi",Rishabh Pant,Sanju Samson,Kuldeep Yadav,"Delhi Capitals 2, Rajasthan Royals 0",False,20,221,8,34,20,201,8,29,"Kuldeep, Mukesh, openers seal crucial win for Capitals. A superb batting effort from Fraser-McGurk, Porel and Stubbs took Capitals to 221","Abishek Porel,Jake Fraser-McGurk","Kuldeep Yadav,Mukesh Kumar","Jake Fraser-McGurk (UKN),Abishek Porel (UKN),Shai Hope (UKN),Axar Patel (AR),Rishabh Pant (WK),Tristan Stubbs (UKN),Gulbadin Naib (AR),Rasikh Salam (BL),Kuldeep Yadav (BL),Mukesh Kumar (BL),Ishant Sharma (BL),Khaleel Ahmed (BL)","Yashasvi Jaiswal (UKN),Jos Buttler (UKN),Sanju Samson (WK),Riyan Parag (UKN),Shubham Dubey (UKN),Rovman Powell (UKN),Donovan Ferreira (AR),Ravichandran Ashwin (AR),Trent Boult (BL),Avesh Khan (BL),Sandeep Sharma (BL),Yuzvendra Chahal (BL)","Sanju Samson,Riyan Parag","Ravichandran Ashwin,Sandeep Sharma",7 May 2024 - night match (20-over match),KN Ananthapadmanabhan,Ulhas Gandhe,Michael Gough,Daniel Manohar,Abhijeet Bengeri
2024,1426295,Sunrisers Hyderabad v Lucknow Super Giants,SRH v LSG,"57th Match (N), Indian Premier League at Hyderabad, May 8 2024",SRH,LSG,LSG,BAT FIRST,165/4,167/0,167/0,165/4,SRH,SRH won by 10 wkts (62b rem),2024-05-08T14:00Z,2024-05-09T23:59Z,58142,"Rajiv Gandhi International Stadium, Uppal, Hyderabad",Pat Cummins,KL Rahul,Travis Head,"Sunrisers Hyderabad 2, Lucknow Super Giants 0",False,9.4,167,0,30,20,165,4,20,"Head, Abhishek and Bhuvneshwar star as SRH smash LSG and knock out MI. Bhuvneshwar Kumar led the stifling of LSG's batters, before Travis Head and Abhishek Sharma blew away their bowlers","Travis Head,Abhishek Sharma","Bhuvneshwar Kumar,Pat Cummins","Abhishek Sharma (AR),Travis Head (UKN),Nitish Kumar Reddy (AR),Heinrich Klaasen (WK),Abdul Samad (UKN),Shahbaz Ahmed (AR),Sanvir Singh (AR),Pat Cummins (BL),Bhuvneshwar Kumar (BL),Jaydev Unadkat (BL),Vijayakanth Viyaskanth (BL),T Natarajan (BL)","KL Rahul (WK),Quinton de Kock (UKN),Marcus Stoinis (AR),Krunal Pandya (AR),Nicholas Pooran (UKN),Ayush Badoni (UKN),Deepak Hooda (AR),Krishnappa Gowtham (AR),Yash Thakur (BL),Ravi Bishnoi (BL),Naveen-ul-Haq (BL)","Ayush Badoni,Nicholas Pooran","Krishnappa Gowtham,Ravi Bishnoi",8 May 2024 - night match (20-over match),Yeshwant Barde,Saidharshan Kumar,Anil Chaudhary,Shakti Singh,Rohan Pandit
