season,id,name,short_name,description,home_team,away_team,toss_won,decision,1st_inning_score,2nd_inning_score,home_score,away_score,winner,result,start_date,end_date,venue_id,venue_name,home_captain,away_captain,pom,points,super_over,home_overs,home_runs,home_wickets,home_boundaries,away_overs,away_runs,away_wickets,away_boundaries,highlights,home_key_batsman,home_key_bowler,home_playx1,away_playx1,away_key_batsman,away_key_bowler,match_days,umpire1,umpire2,tv_umpire,referee,reserve_umpire
2024,1426296,Punjab Kings v Royal Challengers Bengaluru,PBKS v RCB,"58th Match (N), Indian Premier League at Dharamsala, May 9 2024",PBKS,RCB,KXIP,BOWL FIRST,241/7,181,181,241/7,RCB,RCB won by 60 runs,2024-05-09T14:00Z,2024-05-10T23:59Z,58056,"Himachal Pradesh Cricket Association Stadium, Dharamsala",Sam Curran,Faf du Plessis,Virat Kohli,"Royal Challengers Bengaluru 2, Punjab Kings 0",False,17,181,10,30,20,241,7,35,"Kohli keeps RCB alive in playoffs race; Punjab Kings knocked out. Rajat Patidar (55), Cameron Green (46), and the spin duo of Swapnil Singh (2-28) and Karn Sharma (2-36) played their part in the big win","Rilee Rossouw,Shashank Singh","Harshal Patel,Vidwath Kaverappa","Prabhsimran Singh (UKN),Jonny Bairstow (WK),Rilee Rossouw (UKN),Shashank Singh (AR),Jitesh Sharma (UKN),Liam Livingstone (AR),Sam Curran (AR),Ashutosh Sharma (AR),Harshal Patel (BL),Rahul Chahar (BL),Arshdeep Singh (BL),Vidwath Kaverappa (BL)","Virat Kohli (UKN),Faf du Plessis (UKN),Will Jacks (AR),Rajat Patidar (UKN),Cameron Green (AR),Dinesh Karthik (WK),Mahipal Lomror (AR),Swapnil Singh (BL),Karn Sharma (BL),Mohammed Siraj (BL),Lockie Ferguson (BL),Yash Dayal (BL)","Virat Kohli,Rajat Patidar","Mohammed Siraj,Swapnil Singh",9 May 2024 - night match (20-over match),Saiyed Khalid,Nitin Menon,Virender Sharma,Rajiv Seth,Bhavesh Patel
2024,1426297,Gujarat Titans v Chennai Super Kings,GT v CSK,"59th Match (N), Indian Premier League at Ahmedabad, May 10 2024",GT,CSK,CSK,BOWL FIRST,,,231/3,"196/8 (20 ov, target 232)",GT,GT won by 35 runs,2024-05-10T14:00Z,2024-05-11T23:59Z,57851,"Narendra Modi Stadium, Motera, Ahmedabad",Shubman Gill,Ruturaj Gaikwad,None,"Gujarat Titans 2, Chennai Super Kings 0",False,,,,,,,,,,,,,,,,,,,,,
,1426298,Kolkata Knight Riders v Mumbai Indians,KKR v MI,"60th Match (N), Indian Premier League at Kolkata, May 11 2024",KKR,MI,,,,,,,MI,Starts at 19:30 local time,2024-05-11T14:00Z,2024-05-12T23:59Z,57980,"Eden Gardens, Kolkata",,,,,,,,,,,,,,,,,,,,,,,,,,
,1426299,Chennai Super Kings v Rajasthan Royals,CSK v RR,"61st Match (D/N), Indian Premier League at Chennai, May 12 2024",CSK,RR,,,,,,,RR,Starts at 15:30 local time,2024-05-12T10:00Z,2024-05-13T23:59Z,58008,"MA Chidambaram Stadium, Chepauk, Chennai",,,,,,,,,,,,,,,,,,,,,,,,,,
,1426300,Royal Challengers Bengaluru v Delhi Capitals,RCB v DC,"62nd Match (N), Indian Premier League at Bengaluru, May 12 2024",RCB,DC,,,,,,,DC,Starts at 19:30 local time,2024-05-12T14:00Z,2024-05-13T23:59Z,57897,"M.Chinnaswamy Stadium, Bengaluru",,,,,,,,,,,,,,,,,,,,,,,,,,
,1426301,Gujarat Titans v Kolkata Knight Riders,GT v KKR,"63rd Match (N), Indian Premier League at Ahmedabad, May 13 2024",GT,KKR,,,,,,,KKR,Starts at 19:30 local time,2024-05-13T14:00Z,2024-05-14T23:59Z,57851,"Narendra Modi Stadium, Motera, Ahmedabad",,,,,,,,,,,,,,,,,,,,,,,,,,
,1426302,Delhi Capitals v Lucknow Super Giants,DC v LSG,"64th Match (N), Indian Premier League at Delhi, May 14 2024",DC,LSG,,,,,,,LSG,Starts at 19:30 local time,2024-05-14T14:00Z,2024-05-15T23:59Z,58040,"Arun Jaitley Stadium, Delhi",,,,,,,,,,,,,,,,,,,,,,,,,,
,1426303,Rajasthan Royals v Punjab Kings,RR v PBKS,"65th Match (N), Indian Premier League at Guwahati, May 15 2024",RR,PBKS,,,,,,,PBKS,Starts at 19:30 local time,2024-05-15T14:00Z,2024-05-16T23:59Z,680295,"Barsapara Cricket Stadium, Guwahati",,,,,,,,,,,,,,,,,,,,,,,,,,
,1426304,Sunrisers Hyderabad v Gujarat Titans,SRH v GT,"66th Match (N), Indian Premier League at Hyderabad, May 16 2024",SRH,GT,,,,,,,GT,Starts at 19:30 local time,2024-05-16T14:00Z,2024-05-17T23:59Z,58142,"Rajiv Gandhi International Stadium, Uppal, Hyderabad",,,,,,,,,,,,,,,,,,,,,,,,,,
,1426305,Mumbai Indians v Lucknow Super Giants,MI v LSG,"67th Match (N), Indian Premier League at Mumbai, May 17 2024",MI,LSG,,,,,,,LSG,Starts at 19:30 local time,2024-05-17T14:00Z,2024-05-18T23:59Z,58324,"Wankhede Stadium, Mumbai",,,,,,,,,,,,,,,,,,,,,,,,,,
,1426306,Royal Challengers Bengaluru v Chennai Super Kings,RCB v CSK,"68th Match (N), Indian Premier League at Bengaluru, May 18 2024",RCB,CSK,,,,,,,CSK,Starts at 19:30 local time,2024-05-18T14:00Z,2024-05-19T23:59Z,57897,"M.Chinnaswamy Stadium, Bengaluru",,,,,,,,,,,,,,,,,,,,,,,,,,
,1426307,Sunrisers Hyderabad v Punjab Kings,SRH v PBKS,"69th Match (D/N), Indian Premier League at Hyderabad, May 19 2024",SRH,PBKS,,,,,,,PBKS,Starts at 15:30 local time,2024-05-19T10:00Z,2024-05-20T23:59Z,58142,"Rajiv Gandhi International Stadium, Uppal, Hyderabad",,,,,,,,,,,,,,,,,,,,,,,,,,
,1426308,Rajasthan Royals v Kolkata Knight Riders,RR v KKR,"70th Match (N), Indian Premier League at Guwahati, May 19 2024",RR,KKR,,,,,,,KKR,Starts at 19:30 local time,2024-05-19T14:00Z,2024-05-20T23:59Z,680295,"Barsapara Cricket Stadium, Guwahati",,,,,,,,,,,,,,,,,,,,,,,,,,
,1426309,TBC v TBC,TBC v TBC,"Qualifier 1 (N), Indian Premier League at Ahmedabad, May 21 2024",TBA,TBA,,,,,,,TBA,Starts at 19:30 local time,2024-05-21T14:00Z,2024-05-22T23:59Z,57851,"Narendra Modi Stadium, Motera, Ahmedabad",,,,,,,,,,,,,,,,,,,,,,,,,,
,1426310,TBC v TBC,TBC v TBC,"Eliminator (N), Indian Premier League at Ahmedabad, May 22 2024",TBA,TBA,,,,,,,TBA,Starts at 19:30 local time,2024-05-22T14:00Z,2024-05-23T23:59Z,57851,"Narendra Modi Stadium, Motera, Ahmedabad",,,,,,,,,,,,,,,,,,,,,,,,,,
,1426311,TBC v TBC,TBC v TBC,"Qualifier 2 (N), Indian Premier League at Chennai, May 24 2024",TBA,TBA,,,,,,,TBA,Starts at 19:30 local time,2024-05-24T14:00Z,2024-05-25T23:59Z,58008,"MA Chidambaram Stadium, Chepauk, Chennai",,,,,,,,,,,,,,,,,,,,,,,,,,
,1426312,TBC v TBC,TBC v TBC,"Final (N), Indian Premier League at Chennai, May 26 2024",TBA,TBA,,,,,,,TBA,Starts at 19:30 local time,2024-05-26T14:00Z,2024-05-27T23:59Z,58008,"MA Chidambaram Stadium, Chepauk, Chennai",,,,,,,,,,,,,,,,,,,,,,,,,,
